{"allowed_roots":[".",".codex-plugin","assets","scripts","skills","src"],"archive_profile":{"compression":"deflate","compression_level":9,"create_system":3,"format":"zip","name":"plugin-zip-v1","timestamp":"1980-01-01T00:00:00Z"},"codexignore":{"lines":[".git/",".github/",".venv/",".mypy_cache/",".pytest_cache/",".ruff_cache/","__pycache__/","build/","dist/","examples/","planning/","reports/","secrets/","tests/","tools/","*.log","*.pyc","*.pyo",".env","build-constraints.txt","toolchain.lock.json","uv.lock"],"path":".codexignore","sha256":"d2a6140b870e483c108c6c505888df789e1ab11000746935ca99cf68a3be9a85"},"executable_files":["scripts/deep_skills.py","scripts/zagrosi_skills.py"],"generated_overlays":{"marketplace_manifest_path":".agents/plugins/marketplace.json","marketplace_source":"./plugins/zagrosi-forge","plugin_manifest_path":".codex-plugin/plugin.json","plugin_version_pointer":"/version"},"limit_policy_version":"1.0","limits":{"archive_compressed_bytes":"archive_compressed_bytes","archive_expanded_bytes":"archive_expanded_bytes","archive_ratio":"archive_ratio","files":"bundle_files","member_bytes":"bundle_member_bytes","total_bytes":"bundle_total_bytes"},"minimum_reader_version":"0.2.0","policy_version":"1.0","record_digest":"afe9657674728a3d55d453742ba3200cd911584f541ce114691a4f9a93250a67","required_conditions":{"licenses":["LICENSE","NOTICE.md","src/zagrosi_forge/_vendor/tomlkit-LICENSE"],"schemas":["src/zagrosi_forge/install/schemas/bundle-manifest-v1.schema.json","src/zagrosi_forge/install/schemas/bundle-policy-v1.schema.json","src/zagrosi_forge/install/schemas/limit-policy-v1.schema.json","src/zagrosi_forge/install/schemas/marketplace-v1.schema.json","src/zagrosi_forge/install/schemas/native-isolation-policy-v1.schema.json","src/zagrosi_forge/install/schemas/native-support-policy-v1.schema.json","src/zagrosi_forge/install/schemas/ownership-receipt-v1.schema.json","src/zagrosi_forge/install/schemas/plugin-v1.schema.json","src/zagrosi_forge/install/schemas/recovery-retention-policy-v1.schema.json","src/zagrosi_forge/install/schemas/toolchain-lock-v1.schema.json","src/zagrosi_forge/install/schemas/vendor-receipt-v1.schema.json"],"skill_entrypoints":["skills/zagrosi-implement/SKILL.md","skills/zagrosi-plan/SKILL.md","skills/zagrosi-project/SKILL.md"],"vendor_records":["src/zagrosi_forge/_vendor/vendor-receipt.json"]},"required_files":[".codex-plugin/plugin.json","LICENSE","NOTICE.md","README.md","assets/icon.svg","assets/readme-hero.svg","assets/readme-workflow.svg","component-inventory.json","pyproject.toml","scripts/deep_skills.py","scripts/zagrosi_skills.py","skills/zagrosi-implement/SKILL.md","skills/zagrosi-implement/agents/openai.yaml","skills/zagrosi-implement/references/section-update.md","skills/zagrosi-implement/references/tdd-review-git.md","skills/zagrosi-plan/SKILL.md","skills/zagrosi-plan/agents/openai.yaml","skills/zagrosi-plan/references/depth-standards.md","skills/zagrosi-plan/references/domain-ai-products.md","skills/zagrosi-plan/references/domain-auth.md","skills/zagrosi-plan/references/domain-data-migration.md","skills/zagrosi-plan/references/domain-frontend.md","skills/zagrosi-plan/references/domain-infra.md","skills/zagrosi-plan/references/domain-payments.md","skills/zagrosi-plan/references/evaluation.md","skills/zagrosi-plan/references/plan-format.md","skills/zagrosi-plan/references/research.md","skills/zagrosi-plan/references/review.md","skills/zagrosi-plan/references/section-format.md","skills/zagrosi-plan/references/workflow-contract.md","skills/zagrosi-project/SKILL.md","skills/zagrosi-project/agents/openai.yaml","skills/zagrosi-project/references/interview.md","skills/zagrosi-project/references/manifest-format.md","skills/zagrosi-project/references/spec-format.md","skills/zagrosi-project/references/splitting.md","skills/zagrosi-project/references/workflow-contract.md","src/zagrosi_forge/__init__.py","src/zagrosi_forge/_vendor/__init__.py","src/zagrosi_forge/_vendor/tomlkit-LICENSE","src/zagrosi_forge/_vendor/tomlkit/__init__.py","src/zagrosi_forge/_vendor/tomlkit/_compat.py","src/zagrosi_forge/_vendor/tomlkit/_types.py","src/zagrosi_forge/_vendor/tomlkit/_utils.py","src/zagrosi_forge/_vendor/tomlkit/api.py","src/zagrosi_forge/_vendor/tomlkit/container.py","src/zagrosi_forge/_vendor/tomlkit/exceptions.py","src/zagrosi_forge/_vendor/tomlkit/items.py","src/zagrosi_forge/_vendor/tomlkit/parser.py","src/zagrosi_forge/_vendor/tomlkit/py.typed","src/zagrosi_forge/_vendor/tomlkit/source.py","src/zagrosi_forge/_vendor/tomlkit/toml_char.py","src/zagrosi_forge/_vendor/tomlkit/toml_document.py","src/zagrosi_forge/_vendor/tomlkit/toml_file.py","src/zagrosi_forge/_vendor/vendor-receipt.json","src/zagrosi_forge/install/__init__.py","src/zagrosi_forge/install/artifacts.py","src/zagrosi_forge/install/atomic_file.py","src/zagrosi_forge/install/bundle-policy.json","src/zagrosi_forge/install/bundle.py","src/zagrosi_forge/install/config.py","src/zagrosi_forge/install/contracts.py","src/zagrosi_forge/install/diagnostics.py","src/zagrosi_forge/install/legacy-install-catalog.json","src/zagrosi_forge/install/limit-policy.json","src/zagrosi_forge/install/lock.py","src/zagrosi_forge/install/metadata.py","src/zagrosi_forge/install/native-isolation-policy.json","src/zagrosi_forge/install/native-support-policy.json","src/zagrosi_forge/install/ownership.py","src/zagrosi_forge/install/paths.py","src/zagrosi_forge/install/policies.py","src/zagrosi_forge/install/recovery-retention-policy.json","src/zagrosi_forge/install/schemas/bundle-manifest-v1.schema.json","src/zagrosi_forge/install/schemas/bundle-policy-v1.schema.json","src/zagrosi_forge/install/schemas/limit-policy-v1.schema.json","src/zagrosi_forge/install/schemas/marketplace-v1.schema.json","src/zagrosi_forge/install/schemas/native-isolation-policy-v1.schema.json","src/zagrosi_forge/install/schemas/native-support-policy-v1.schema.json","src/zagrosi_forge/install/schemas/ownership-receipt-v1.schema.json","src/zagrosi_forge/install/schemas/plugin-v1.schema.json","src/zagrosi_forge/install/schemas/recovery-retention-policy-v1.schema.json","src/zagrosi_forge/install/schemas/toolchain-lock-v1.schema.json","src/zagrosi_forge/install/schemas/vendor-receipt-v1.schema.json","src/zagrosi_forge/install/toolchain-lock.json","src/zagrosi_forge/install/toolchain.py","src/zagrosi_forge/install/vendor.py","src/zagrosi_forge/install/version.py"],"schema_digest":"f768ef3c46d7c1c38259f0c10c00ac5b5a955a8b595d7b8bea69908437de8d22","schema_version":"1.0","validation_only_files":[".agents/plugins/marketplace.json",".codexignore"],"writer_version":"0.2.0"}
